{
  "sidecar_version": 1,
  "skill": "earnings-deep-dive",
  "findings": [
    {
      "statement": "Margin held",
      "direction": "supports",
      "source": "10-Q p.14"
    }
  ],
  "produced_at": "2026-08-16T13:48:02Z",
  "security_id": "sec:nvda",
  "job_id": "JOB-01a00ad4-54f5-7030-87c5-1560094d232b"
}